{"applicability_policy_id":"rcid:v1:applicability-policy:h:jcs-sha256-v1:5b7c213415632bfa60da5b629c417ef374803f9078502e3b0ba0b56c7edc3579","campaign_definition_id":"rcid:v1:campaign-definition:u7:019ffc57-9ad1-7dfa-bf03-9464bd047e20","campaign_definition_revision_id":"rcid:v1:campaign-definition-revision:h:jcs-sha256-v1:58b67b505495051fc6fecbb7dd2a1aee2cd1ac4d984dcd3016efd11e5178acb3","campaign_id":"rcid:v1:campaign:u7:019ffc57-9ad1-7d54-9aff-ea92443bece2","campaign_manifest":{"applicability_policy_id":"rcid:v1:applicability-policy:h:jcs-sha256-v1:5b7c213415632bfa60da5b629c417ef374803f9078502e3b0ba0b56c7edc3579","campaign_definition_revision_id":"rcid:v1:campaign-definition-revision:h:jcs-sha256-v1:58b67b505495051fc6fecbb7dd2a1aee2cd1ac4d984dcd3016efd11e5178acb3","campaign_id":"rcid:v1:campaign:u7:019ffc57-9ad1-7d54-9aff-ea92443bece2","campaign_manifest_id":"rcid:v1:campaign-manifest:h:jcs-sha256-v1:8a65037e12ff5905387dae8d51f87aa68e42165bb442d9b09c5f7bd8fa38da57","classification":{"completion_denominator":"development-only","normative_authority":false,"probe_only":true,"semantic_authority":false},"denominator":{"candidate_count":48,"excluded_count":22,"included_count":26,"invalid_count":0,"unresolved_count":0},"exclusion_ledger_id":"rcid:v1:exclusion-ledger:h:jcs-sha256-v1:a4650bd66d8f963447aea91122097cbff191606aa27e4f0df91daaa4f7c3ad95","logical_execution_ids":["rcid:v1:logical-execution:h:jcs-sha256-v1:03db83d5a4970eaadaeb1f1845293c69f1ebad63cc62c2dfa3a9017fede42480","rcid:v1:logical-execution:h:jcs-sha256-v1:0fea54cc15295748682ff6fb978584021a4157880f1b6e3953b975771e7e975b","rcid:v1:logical-execution:h:jcs-sha256-v1:1199cfa1a9bac53be796249fed412942d54cb0d28731759685787eae625cb58d","rcid:v1:logical-execution:h:jcs-sha256-v1:17ce175399e119508e05ac09567d69bd60d9f807c308d7c393c9dd32591cef89","rcid:v1:logical-execution:h:jcs-sha256-v1:284a61af5c84613e4e1a170f9d7cf1a7eba5c248cad0f8edd0b3b9627b3b457e","rcid:v1:logical-execution:h:jcs-sha256-v1:29c3ec91a4081eda7f44ffba25dab13245f781027df397079c8d8962275144dc","rcid:v1:logical-execution:h:jcs-sha256-v1:3624802b374867a91e8f6235c6ecc8ec0f74a81b2d25e64a8bdadb95ef2ae505","rcid:v1:logical-execution:h:jcs-sha256-v1:38dd72b8c990faad870cbe09b71a3e1768376d4e61609e346549f9f7c59a92c3","rcid:v1:logical-execution:h:jcs-sha256-v1:3e211dd891f0ee7bd9893e5e59901f3df6b4e66d728b07015965c052abf8e3fa","rcid:v1:logical-execution:h:jcs-sha256-v1:4abd21216b214e55151ce3e41fdf5415412510834f368c89dea59b6d6dafd0c7","rcid:v1:logical-execution:h:jcs-sha256-v1:6e47a2c69e2c8b88174eb1928b6c48194fbbea0da40f82d5bda9dfedd3bbb617","rcid:v1:logical-execution:h:jcs-sha256-v1:77cbf75240f7c306d7705bf343f53f967bc478e7cec94ec275b3b7612b6391b6","rcid:v1:logical-execution:h:jcs-sha256-v1:90df06dcef56737a3142cc7d3fee4691ed2dbda1920bf4c9db4fb7196be859e6","rcid:v1:logical-execution:h:jcs-sha256-v1:939afaf5e8cb5162d70f41d56c4ba10e86d3ec87e46cf7aafec16ac8b0fb09b5","rcid:v1:logical-execution:h:jcs-sha256-v1:9c3d90b014e9948648b976e650aeb247d1a9c8a3679647346b6189756741334a","rcid:v1:logical-execution:h:jcs-sha256-v1:b2fd7c9750e83f3cd7bdfa11122fce8fa8300bf50b7e6ae0fd8fe384548c445e","rcid:v1:logical-execution:h:jcs-sha256-v1:b6b18347081605cd50462a7bf2c04406826bd55a02fc4e741e2cb47a471de2da","rcid:v1:logical-execution:h:jcs-sha256-v1:c3a673cf1cec98983c0288cec9415d01048163abe3953fc1bfc47ffdb71522a1","rcid:v1:logical-execution:h:jcs-sha256-v1:c9f58d49265d78a705913c22df29accbb4d74d0c7af10621cbbc2fdc23b05f8e","rcid:v1:logical-execution:h:jcs-sha256-v1:cd3640c6434a312dc1adc6c37e670a6080985798a534c88a05d0ebc044f326dc","rcid:v1:logical-execution:h:jcs-sha256-v1:e2c846d30ef95fa5f1d18436af1ef4b3323939d72e730c648aac62d126863d29","rcid:v1:logical-execution:h:jcs-sha256-v1:e6a8a6e507a5ff4c5e71675c1f9a164fe45b7c38b51a946c4b173ae79dfc134c","rcid:v1:logical-execution:h:jcs-sha256-v1:e8b5dd2a5c23e58352fe534aa8d2154a4145421e0a458cb8016e2567afd50332","rcid:v1:logical-execution:h:jcs-sha256-v1:e9d289a012ee8f950218cf18911149a3eccfa0b1924a54c5fe3a42242c5dbf61","rcid:v1:logical-execution:h:jcs-sha256-v1:efc89da0606175313835634f45364245f6b13efdc6705891aaa01400e8cd8cb2","rcid:v1:logical-execution:h:jcs-sha256-v1:fe41bca7cab020d36b5101bf4e96e83b4ad4838098c321e3e6feddb52304a73b"],"matrix_id":"rcid:v1:matrix:h:jcs-sha256-v1:53ab1c66b4d74612e1c7e77e0724842d935aea8464b0b40fb71b058938bed4f8","policy":{"attempts_are_append_only":true,"infrastructure_failure_is_observation":false,"maximum_attempts_per_logical_execution":1,"sharding":"bounded-selection-locality-then-logical-id-v1"},"shard_ids":["rcid:v1:shard:h:jcs-sha256-v1:11e2f4594a46d370260b7cc623054abc10d275854fabedaf2233bf64369dec10","rcid:v1:shard:h:jcs-sha256-v1:2a2e537b967ed40ede473a822134109f6c19c36a7ae1e91c8d9bfb786ae761f5","rcid:v1:shard:h:jcs-sha256-v1:512c4915fac7c4710f520333b3bded9a17f58c65c08731a237d8d356d3611908","rcid:v1:shard:h:jcs-sha256-v1:8dfbb71d750981b08fc9456e78707714828df301959f978c1f9514d641c5d7ee","rcid:v1:shard:h:jcs-sha256-v1:d0529b6d65a0923b91e81d6ca1db1328ea052059488da7b274abc7fb64a14ad5"],"source_digests":{"adapters/manifests/mysql-regex.v1.json":"eb1101aa2f344c9e23e5bf27b40445dc17693e351b38f4d1e76bff47921ee49e","adapters/manifests/pcre2-ordinary.v1.json":"a04da525615b24efa4cc184aba77aa4d8a382d7c30bba98eb0c2a5460258474a","adapters/manifests/python-re.v1.json":"d207cb7f8cb9c53c94e206dca52159af5a583733aa5d8ad657304650611dc07d","adapters/qualification-manifests/pcre2-dfa.v1.json":"f33f7aadbb08736aadb35829b810aed798a8070430fe396fcb8e1aaa133af1e2","applicability/policies/small-scale-qualification.v1.json":"9fbe7bef209da06b13b06dc3764a66657c8227346eccc66fc90880d35e652b31","campaigns/definitions/small-scale-qualification.v1.json":"1bb338d5fa7f68b841d0623afcaf2810dead92daeaac5d93adf7d0ac6831ffd4","campaigns/python/regex_conformance_campaign/compiler.py":"164616a367e8591947b8ab75f767ea95bfef2e27b9f1c9dcc33396e67cc66d74","campaigns/python/regex_conformance_qualification/compiler.py":"a4b4799c19f0a25d1b511afdd6a0555b7477195cf81d4adffb2893e15f1c4576","environments/qualification-recipes/pcre2-dfa-10.47-linux-x86-64.v1.json":"44859c31761a2ec220e6933d6f1ee9f20c195d5491a639ca3dc7f2cc42510fc5","environments/recipes/cpython-3.14.6-linux-24.04-x64.v1.json":"039de4748fe71ade0823538cb0d88a84ccc156862ab5acae95cb460095b21a18","environments/recipes/mysql-8.4.10-linux-amd64.v1.json":"4732ab7cb25bcd7903399026641ccaf6e3e4a08f712d6602bec9cb4f6d2a48e5","environments/recipes/pcre2-10.47-linux-x86-64.v1.json":"96c13d57b1fe85864790dbcb4ce800b604b3531b5d197761aa895b01d692e9ca","matrix/python/regex_conformance_matrix/applicability.py":"4d0f82409ba392a219e53db254aa27a43155e01e70c6bd3843771874053d939d","registries/profiles/small-scale-qualification.v1.json":"2295ed2e8cc096b4623317b321356c636a94e0991398be39db6a64cd0a883df6","registries/profiles/vertical-slice-coordinates.v1.json":"1e390e349226bbbdc87abb70112abea1539b2ff83713d1bcd110cb366ccfbbc9","scheduler/python/regex_conformance_scheduler/sharding.py":"dd287b7568d84b9eda23b3470fc72dff4bf4acdf7abe25eddb7117f65f6ff67b","schemas/json/adapter-request.schema.json":"e146692ed9449030d062becf55757dfe049db99baf0e4c12ccb1f7aef95ae2d0","schemas/json/adapter-response.schema.json":"e52b6cd9349472a030a0cca95f45b4d099f5912a1601bf8b4ed7fe7c82b7c4e0","schemas/json/compiled-campaign.schema.json":"4efe6e13774a9632ea55a1055557f5f4025f8963da48593be89ac473ffe25f00","vectors/definitions/small-scale-qualification.v1.json":"92a8f6068a699681b544bdbb7bfcbc5cd83bb0058c65223cc91c732736fa1fee"}},"campaign_manifest_id":"rcid:v1:campaign-manifest:h:jcs-sha256-v1:8a65037e12ff5905387dae8d51f87aa68e42165bb442d9b09c5f7bd8fa38da57","candidates":[{"applicability":"excluded","candidate_key":"mysql-regex:capture-participation-octets","profile_id":"rcid:v1:profile:u7:019ff984-a52e-711e-82d2-03b77a6192e7","proof":{"outcome_source":"default-outcome","policy_id":"rcid:v1:applicability-policy:h:jcs-sha256-v1:5b7c213415632bfa60da5b629c417ef374803f9078502e3b0ba0b56c7edc3579","predicate":"exact-selection-and-vector-key-membership","rule_key":null,"selection_key":"mysql-regex","vector_key":"capture-participation-octets"},"selection_key":"mysql-regex","vector_revision_id":"rcid:v1:vector-revision:h:jcs-sha256-v1:81a0484438f92b748d6729d26566aa1e2adaeb4bc154943aec3e2bc619e8e969"},{"applicability":"excluded","candidate_key":"mysql-regex:capture-participation-unicode","profile_id":"rcid:v1:profile:u7:019ff984-a52e-711e-82d2-03b77a6192e7","proof":{"outcome_source":"default-outcome","policy_id":"rcid:v1:applicability-policy:h:jcs-sha256-v1:5b7c213415632bfa60da5b629c417ef374803f9078502e3b0ba0b56c7edc3579","predicate":"exact-selection-and-vector-key-membership","rule_key":null,"selection_key":"mysql-regex","vector_key":"capture-participation-unicode"},"selection_key":"mysql-regex","vector_revision_id":"rcid:v1:vector-revision:h:jcs-sha256-v1:173abcacce385dfb7557a0d2a518bc9b176cb8f09671caa8c97cec19de392d20"},{"applicability":"excluded","candidate_key":"mysql-regex:compile-rejection-octets","profile_id":"rcid:v1:profile:u7:019ff984-a52e-711e-82d2-03b77a6192e7","proof":{"outcome_source":"default-outcome","policy_id":"rcid:v1:applicability-policy:h:jcs-sha256-v1:5b7c213415632bfa60da5b629c417ef374803f9078502e3b0ba0b56c7edc3579","predicate":"exact-selection-and-vector-key-membership","rule_key":null,"selection_key":"mysql-regex","vector_key":"compile-rejection-octets"},"selection_key":"mysql-regex","vector_revision_id":"rcid:v1:vector-revision:h:jcs-sha256-v1:d38137a95cb9b8544f19f9acd76586694f67d3def62dd671b538db4718537047"},{"applicability":"included","candidate_key":"mysql-regex:compile-rejection-unicode","profile_id":"rcid:v1:profile:u7:019ff984-a52e-711e-82d2-03b77a6192e7","proof":{"outcome_source":"matched-rule","policy_id":"rcid:v1:applicability-policy:h:jcs-sha256-v1:5b7c213415632bfa60da5b629c417ef374803f9078502e3b0ba0b56c7edc3579","predicate":"exact-selection-and-vector-key-membership","rule_key":"mysql-compile-rejection-unicode","selection_key":"mysql-regex","vector_key":"compile-rejection-unicode"},"selectio